position,channelId,channelTitle,videoId,publishedAt,publishedAtSQL,videoTitle,videoDescription,tags,videoCategoryId,videoCategoryLabel,topicCategories,duration,durationSec,dimension,definition,caption,defaultLanguage,defaultLAudioLanguage,thumbnail_maxres,licensedContent,locationDescription,latitude,longitude,viewCount,likeCount,dislikeCount,favoriteCount,commentCount
1,UCO5BR4Ex3EM8PSLU7OSqtOw,"La Revuelta ",6Obtu1kz8CQ,2024-10-10T07:00:06Z,"2024-10-10 07:00:06","Yunez presenta el país de Jovenlandia | #LaRevuelta 09.10.2024","La Revuelta 1x19 | Por fin se habla de este país que tanto se menciona en comentarios. La Revuelta, de lunes a jueves en TVE a las 21:40h, y todos los programas en RTVE PLAY https://www.rtve.es/play/la-revuelta/ ___REDES SOCIALES___ Tik Tok https://www.tiktok.com/@larevuelta_tve Instagram https://www.instagram.com/larevuelta_tve Twitter https://x.com/LaRevuelta_TVE Facebook https://www.facebook.com/people/La-Revuelta","la revuelta,david broncano,Jorge Ponce,Grison,Grison Beatbox,Ricardo Castella,Sergio Bezos,La Resistencia,RTVE,RTVE Play",22,"People & Blogs","Entertainment,Television_program",PT6M31S,391,2d,hd,false,,,,1,,,,47599,1712,,0,298
2,UCyCFENTHXNezw2VS2ZNCmCg,"PERESTROIKA TV",w0l1jDvdbSs,2024-09-17T22:00:48Z,"2024-09-17 22:00:48","Musulmán no quiere que bebas en la calle #islam#jovenlandes","Musulmán interpela a hombre por beber alcohol en público e insta a los vecinos a agredirlo por esto.",,25,"News & Politics","Politics,Society",PT44S,44,2d,hd,false,,,https://i.ytimg.com/vi/w0l1jDvdbSs/maxresdefault.jpg,,,,,98,4,,0,1
3,UCKtX-l6WHwkwRS2Wh_Vg9Bw,"Divergente Digital",bWQQO1zX61M,2024-12-08T20:30:03Z,"2024-12-08 20:30:03","PROGRE DEFIENDE JOVENLANDIA EN ESPAÑA: ""LA PERCEPCIÓN DE LA GENTE NO ES CORRECTA""","SIGUE NUESTRAS REDES - INSTAGRAM: instagram.com/divergenciadigital - CANAL DE TELEGRAM: https://t.me/divergenciadigital0 - FACEBOOK: https://www.facebook.com/profile.php?id=61564032608814&locale=es_ES - TIK TOK: https://www.tiktok.com/@divergentedigitaloficial",,25,"News & Politics","Politics,Society",PT2M50S,170,2d,hd,false,,es,https://i.ytimg.com/vi/bWQQO1zX61M/maxresdefault.jpg,1,,,,2142,335,,0,79
4,UCblSvPjlRkLBxm6Qe9zXGUQ,Paisanaje,9ETQ0QvugTU,2024-02-21T16:01:00Z,"2024-02-21 16:01:00","Jovenlandia y el Auge del Crimen Juvenil","En este vídeo leemos y analizamos diversos sucesos y casos repetidos a lo largo de mes donde se repite un patrón significativo de un determinado perfil de delincuente. En España la seguridad en las calles cada vez es menor. Necesitamos tomar medidas contra el modelo migratorio y contra la delincuencia en general. ❤️ Canal secundario ASMR: https://www.youtube.com/@DuermeVela 🧡 Instagram: 💙 PayPal: 💜 Twitch: 🖤 Twitter X: https://twitter.com/Paisanaje2019 ✉️ Correo: paisanaje2019@gmail.com #españa #jovenlandia #inmigracion #delitos #seguridad #actualidad #noticias #opinion #jovenlandeses #inmigrantes","España,crimen,inmigracion,seguridad,jovenlandia,jovenlandeses,opinion,actualidad,seguridad en las calles,inmigracion masiva,delincuencia en las calles,barcelona no es segura,españa no es segura,problemas de la inmigracion,multiculturalidad,agenda 2030 inmigracion,agenda 2030,robos españa",24,Entertainment,"Politics,Society",PT8M2S,482,2d,hd,false,,es,https://i.ytimg.com/vi/9ETQ0QvugTU/maxresdefault.jpg,1,,,,5652,729,,0,154
5,UC9FbftbYAcIhNprxOEDLY6w,JOVENLANDIA,WuEFtQis88A,2025-03-28T07:00:14Z,"2025-03-28 07:00:14","Opiniones. ..? #antena3 #pedrosánchez #vox #jovenlandes #mena",,,22,"People & Blogs",Lifestyle_(sociology),PT21S,21,2d,hd,false,,,https://i.ytimg.com/vi/WuEFtQis88A/maxresdefault.jpg,,,,,477,3,,0,0
6,UCKtX-l6WHwkwRS2Wh_Vg9Bw,"Divergente Digital",Khib7cBqnxk,2025-06-02T12:00:36Z,"2025-06-02 12:00:36","INGENIERO DE JOVENLANDIA REVISA MOTOS EN MADRID 🚨",,,25,"News & Politics",Vehicle,PT1M8S,68,2d,hd,false,,es,https://i.ytimg.com/vi/Khib7cBqnxk/maxresdefault.jpg,1,,,,40760,2308,,0,376
7,UCyYu8An_cPCbICltIAX3lUQ,"Noticias Stereo oeste",fVWo3lFqASU,2024-03-21T03:00:18Z,"2024-03-21 03:00:18","¿Qué es ser Jovenlandia o jovenlandés en España?","Manuel Mariscal explica a la directora de contenidos de la Cadena SER qué es un jovenlandés y le pregunta por qué se oculta en la prensa el origen de quienes cometen delitos cuando son extranjeros.",,25,"News & Politics","Politics,Society",PT1M49S,109,2d,hd,false,,es,https://i.ytimg.com/vi/fVWo3lFqASU/maxresdefault.jpg,,,,,920,32,,0,1
8,UCKtX-l6WHwkwRS2Wh_Vg9Bw,"Divergente Digital",XbFgj8ecxxw,2025-02-05T15:40:01Z,"2025-02-05 15:40:01","POV: DOCTOR DE JOVENLANDIA EN MELILLA 😁",,,25,"News & Politics",Lifestyle_(sociology),PT18S,18,2d,hd,false,,es,https://i.ytimg.com/vi/XbFgj8ecxxw/maxresdefault.jpg,1,,,,179269,6405,,0,698
9,UCKtX-l6WHwkwRS2Wh_Vg9Bw,"Divergente Digital",FlKKolVBrFM,2024-12-12T18:35:00Z,"2024-12-12 18:35:00","EXHIBICIÓN JOVENLANDESA EN CENTRO COMERCIAL MERIDIANO, TENERIFE 😄","SIGUE NUESTRAS REDES - INSTAGRAM: instagram.com/divergenciadigital - CANAL DE TELEGRAM: https://t.me/divergenciadigital0 - FACEBOOK: https://www.facebook.com/profile.php?id=61564032608814&locale=es_ES - TIK TOK: https://www.tiktok.com/@divergentedigitaloficial",,25,"News & Politics",,PT2M45S,165,2d,hd,false,,es,https://i.ytimg.com/vi/FlKKolVBrFM/maxresdefault.jpg,1,,,,568756,29862,,0,3829
10,UCKtX-l6WHwkwRS2Wh_Vg9Bw,"Divergente Digital",aQ3c-IHKu-M,2025-05-17T16:30:00Z,"2025-05-17 16:30:00","LAS OLIMPIADAS DE JOVENLANDIA EN BARCELONA 🚨","SIGUE NUESTRAS REDES - INSTAGRAM: instagram.com/divergenciadigital - CANAL DE TELEGRAM: https://t.me/divergenciadigital0 - FACEBOOK: https://www.facebook.com/profile.php?id=61564032608814&locale=es_ES - TIK TOK: https://www.tiktok.com/@divergentedigitaloficial",,25,"News & Politics",Lifestyle_(sociology),PT39S,39,2d,hd,false,,es,https://i.ytimg.com/vi/aQ3c-IHKu-M/maxresdefault.jpg,1,,,,17232,1609,,0,153
11,UC_-5Cnjv-CBcw908PSnp78w,"Lagrimas Progres",vD3j-8ebuOM,2025-02-18T14:08:06Z,"2025-02-18 14:08:06","JOVENLANDES PROHIBE COMER JAMÓN a su CHICA ""FEMINISTA"" y ACABA ACEPTANDOLO! PARA CUANDO EL BURKA?","El feminismo ha dejado frito el cerebro de muchas mujeres, que no se dan cuenta de los peligros reales... Puedes apoyarme en BIZUM: 644942998 En Paypal: lagrimasprogres@hotmail.com En Patreon: https://www.patreon.com/LagrimasProgres En Youtube: https://www.youtube.com/channel/UC_-5Cnjv-CBcw908PSnp78w/join - Tienda en Teespring: https://teespring.com/es/stores/lagrimas-progres Twitch: https://bit.ly/302gmxK Noticiero Pijoprogre: https://www.youtube.com/channel/UCVah-N3xLnD3JseU9sjoczw Twitter: https://twitter.com/LagrimasProgres Canal de análisis e información política española, con noticias, humor y las intervenciones más polémicas del Congreso de los Diputados, del Senado y de otras cámaras autonómicas. Intervenciones de los principales líderes políticos: Santiago Abascal, Ortega Smith, Macarena Olona, Pedro Sánchez, Pablo Casado, Cayetana Álvarez de Toledo, Irene Montero, Yolanda Díaz etc. Vídeos de los principales partidos: VOX, PP, Ciudadanos, PSOE, Podemos, ERC, PdeCAT, BILDU, etc. No Copyright Motion Graphics Motion Graphics provided by https://www.youtubestock.com YouTube Channel: https://goo.gl/aayJRf",,25,"News & Politics","Politics,Society",PT18M31S,1111,2d,hd,false,,es,https://i.ytimg.com/vi/vD3j-8ebuOM/maxresdefault.jpg,1,,,,17247,1929,,0,402
12,UCQTToXMulQJyrRwz2yGUjBQ,"Carlos De Luis",bRAhC_xhXPo,2025-03-05T17:23:25Z,"2025-03-05 17:23:25","jovenlandes apuñala a vigilante###mirar el vídeo",,,22,"People & Blogs",Society,PT16S,16,2d,hd,false,,,https://i.ytimg.com/vi/bRAhC_xhXPo/maxresdefault.jpg,,,,,1838,303,,0,26
13,UCIeZSHy2yO--9BLjTy-dP4Q,"Tony Montana",yEDEJ0DFW_U,2024-09-04T13:37:11Z,"2024-09-04 13:37:11","Ser de Luz Jovenlandes no come jamon ententa robar indigente robo carterista pickpockets Barcelona","Ser de Luz Jovenlandes no come jamon ententa robar indigente robo carterista pickpockets Barcelona",,25,"News & Politics",,PT2M52S,172,2d,hd,false,it,,https://i.ytimg.com/vi/yEDEJ0DFW_U/maxresdefault.jpg,,"Burger King",41.3857725,2.1765792,63500,1212,,0,976
14,UCcGhXofCKom-klIIP_8_agA,VYT,_c4JPVXbink,2024-07-10T21:23:17Z,"2024-07-10 21:23:17","CHICO JOVENLANDES INTENTA SOBRE PASARSE CON GUARDIA REAL #UK #reinounido","Chico molesta a guardia real y turista le defiende. Al hacerlo el chico se encara con el turista hasta que la policía se lo lleva arrestado. Canal sobre política española qué resume intervenciones de las más polémicas en el Congreso de los Diputados y también del Senado e investigaciones e imputaciones de los más relevantes personajes de la política española. conocerás la verdad de la política española sin censura alguna. Intervenciones de los principales líderes políticos Pedro SÁNCHEZ, Isabel Díaz AYUSO, Iván Espinosa de los MONTEROS, Santiago Abascal, Cayetana Álvarez de Toledo, Irene Montero, Pablo Iglesias, Almeida, Feijoo y más.. Veremos a los distintos portavoces en vídeos de los distintos partidos: de VOX, PP, PSOE, PODEMOS, BILDU, ERC, Sumar, Se acabó la Fiesta. #PolíticaEspañola #PedroSánchez #Feijoo #Abascal #CongresoDeLosDiputados #Senado #IntervencionesPolíticas #DebatePolítico #PSOE #PP #VOX #Podemos #Bildu #ERC #Sumar #SinCensura #PolíticaSinFiltros #NoticiasPolíticas #DebatesParlamentarios #noticias #actualidad #tendencias #Milei #madrid #ayuso #ALVISE #salf Tienda de ropa y accesorios dedicados al Perro: por7votostieneselculoroto.es",,25,"News & Politics","Politics,Society",PT58S,58,2d,hd,false,,,https://i.ytimg.com/vi/_c4JPVXbink/maxresdefault.jpg,,España,40.463667,-3.74922,16284,1579,,0,229
15,UC2T6NU6-JLWzAzaGdqvNyzA,"El Toro TV",RbvfNAd_0OE,2024-02-29T22:08:00Z,"2024-02-29 22:08:00","De “jovenlandia” a “desarraigolandia”: la nueva forma de esconder la delincuencia de los inmigrantes","¿Por qué cuando en la página de sucesos aparece un crimen cometido por un inmigrante se suele esconder la nacionalidad? ¿Por qué cuando quien comete el delito es un español se incide especialmente en que no es alguien de fuera? Esta es la reflexión de Esparza sobre la forma en la que los medios de comunicación cubren este tipo de noticias, prestando especial atención al nuevo modo de esconder el origen de los criminales ✔ Toda la actualidad nacional e internacional contada desde un punto de vista políticamente incorrecto, aquí: www.eltorotv.com ✔ SUSCRÍBETE al canal si no quieres perderte ningún momentazo ✔ Para ver los PROGRAMAS COMPLETOS de El Toro TV, hazlo aquí @programaseltorotv","eltorotv,el toro tv,verdad,libre,independiente,julio ariza,jose javier esparza,xavier horcajo,alba vila,política,política española,Gobierno de España,Medio de comunicación,Noticias,Actualidad,Última hora",25,"News & Politics","Politics,Society,Television_program",PT2M9S,129,2d,hd,false,,es-ES,https://i.ytimg.com/vi/RbvfNAd_0OE/maxresdefault.jpg,1,,,,1074,64,,0,7
16,UCRte5IhQVwgD5Dh-kL9SOLg,"La ventana esmeralda",aOkNfi_aEFY,2024-03-28T21:20:27Z,"2024-03-28 21:20:27","¿Qué es un jovenlandés? #shorts #jovenlandes #inmigrantes #inmigracionirregular",,,24,Entertainment,"Politics,Society",PT49S,49,2d,hd,false,,,https://i.ytimg.com/vi/aOkNfi_aEFY/maxresdefault.jpg,1,,,,12148,592,,0,32
17,UCKtX-l6WHwkwRS2Wh_Vg9Bw,"Divergente Digital",NNp96GAtirU,2025-03-23T22:00:17Z,"2025-03-23 22:00:17","🚨 DOCTORES DE JOVENLANDIA AGREDEN A UN HOMBRE EN PLENA CALLE EN IRÚN 🚨","SIGUE NUESTRAS REDES - INSTAGRAM: instagram.com/divergenciadigital - CANAL DE TELEGRAM: https://t.me/divergenciadigital0 - FACEBOOK: https://www.facebook.com/profile.php?id=61564032608814&locale=es_ES - TIK TOK: https://www.tiktok.com/@divergentedigitaloficial",,25,"News & Politics",Society,PT56S,56,2d,hd,false,,es,https://i.ytimg.com/vi/NNp96GAtirU/maxresdefault.jpg,1,,,,4728,1127,,0,147
18,UCKtX-l6WHwkwRS2Wh_Vg9Bw,"Divergente Digital",mE16cr8PKYs,2025-01-31T15:30:19Z,"2025-01-31 15:30:19","INGENIERO DE JOVENLANDIA EN EL METRO DE BARCELONA 😁",,,25,"News & Politics",Lifestyle_(sociology),PT23S,23,2d,hd,false,,es,https://i.ytimg.com/vi/mE16cr8PKYs/maxresdefault.jpg,1,,,,152809,5321,,0,848
19,UCKtX-l6WHwkwRS2Wh_Vg9Bw,"Divergente Digital",UMhoOl2Cqpk,2025-04-11T12:00:52Z,"2025-04-11 12:00:52","EXHIBICIÓN DE INGENIERO DE JOVENLANDIA EN VALENCIA 🙄",,,25,"News & Politics",,PT37S,37,2d,hd,false,,es,https://i.ytimg.com/vi/UMhoOl2Cqpk/maxresdefault.jpg,1,,,,209596,5069,,0,270
20,UCNVtRMtStbXvx98GjZpXwPg,"Unidos por la Patria 🇪🇸",G_TnlUwtoRE,2025-04-17T16:37:18Z,"2025-04-17 16:37:18","Jovenlandes starter pack 🇪🇸",,,22,"People & Blogs",Lifestyle_(sociology),PT47S,47,2d,hd,false,,,https://i.ytimg.com/vi/G_TnlUwtoRE/maxresdefault.jpg,,,,,101,4,,0,2
21,UCVWayOJ3IjEnNEzbLIRgApA,"La Ricktadura",zeBLTGR9zzQ,2024-10-18T18:00:40Z,"2024-10-18 18:00:40","DANI De DESOKUPA CAZA JOVENLANDES","Críticas y reflexiones de videos que se encuentran en el internet, acompañados de alguna que otra libación. Discord: https://discord.gg/Gp4G7BwxHS Cafecito: https://cafecito.app/ricktador Ko-Fi: https://ko-fi.com/ricktadorsupremo (para donaciones desde el extranjero) Twitch: https://www.twitch.tv/la_ricktadura Instagram: https://www.instagram.com/rickandtonic/ Twitter: https://twitter.com/ricktador","la ricktadura,ricktadura,milei,politica,argentina,japon,japones,liberalismo,libertario,derecha",25,"News & Politics",Society,PT7M10S,430,2d,hd,false,es,es,https://i.ytimg.com/vi/zeBLTGR9zzQ/maxresdefault.jpg,1,,,,2172,75,,0,17
22,UCKtX-l6WHwkwRS2Wh_Vg9Bw,"Divergente Digital",HsEGhUPY18w,2025-03-12T18:00:12Z,"2025-03-12 18:00:12","🚨 INGENIERO DE JOVENLANDIA LANZA PENSIÓN CONTRA UN TAXI EN SANTS, BARCELONA 🚨","SIGUE NUESTRAS REDES - INSTAGRAM: instagram.com/divergenciadigital - CANAL DE TELEGRAM: https://t.me/divergenciadigital0 - FACEBOOK: https://www.facebook.com/profile.php?id=61564032608814&locale=es_ES - TIK TOK: https://www.tiktok.com/@divergentedigitaloficial",,25,"News & Politics","Politics,Society",PT48S,48,2d,hd,false,,es,https://i.ytimg.com/vi/HsEGhUPY18w/maxresdefault.jpg,1,,,,12897,2341,,0,307
23,UCKtX-l6WHwkwRS2Wh_Vg9Bw,"Divergente Digital",DvZfa0HheMU,2025-02-26T15:00:22Z,"2025-02-26 15:00:22","ALBAÑILES SORPRENDEN A INGENIERO DE JOVENLANDIA CON UNA MOTO Y PASA ESTO 🚨",,,25,"News & Politics","Politics,Society",PT43S,43,2d,hd,false,,es,https://i.ytimg.com/vi/DvZfa0HheMU/maxresdefault.jpg,1,,,,171048,9195,,0,621
24,UCO5BR4Ex3EM8PSLU7OSqtOw,"La Revuelta ",p-82VwYmwqY,2024-10-10T12:00:52Z,"2024-10-10 12:00:52","El país de Jovenlandia | #LaRevuelta 09.10.2024",,"la revuelta,david broncano,Jorge Ponce,Grison,Grison Beatbox,Ricardo Castella,Sergio Bezos,La Resistencia,RTVE,RTVE Play",22,"People & Blogs","Entertainment,Humour,Politics,Television_program",PT57S,57,2d,hd,false,,,https://i.ytimg.com/vi/p-82VwYmwqY/maxresdefault.jpg,1,,,,23924,702,,0,103
25,UCUip9IBtzBXjqW2bY2l1ybw,SrFlaco,Ss1OFcNsCGE,2023-12-10T18:30:15Z,"2023-12-10 18:30:15","Intento de asesinato en Orihuela Alicante #jovenlandeses #jovenlandia",,,24,Entertainment,Society,PT25S,25,2d,hd,false,en-US,es-ES,https://i.ytimg.com/vi/Ss1OFcNsCGE/maxresdefault.jpg,,,,,251,6,,0,1
26,UC0iBrlRvRK6m8_dHXPKrfkw,"Carlos Adams VlogCast",LHW9EVJwpY8,2024-04-05T11:00:27Z,"2024-04-05 11:00:27","JOVENLANDES ROBA Y PASA ESTO RT//703-4","Enciclopedia👉 0,19 https://carlos-adams.com/ Sígueme en: 📷 Instagram: https://www.instagram.com/carlos.adams/ 💜 Twitch: https://www.twitch.tv/carlos_adams 🐦Twitter: https://twitter.com/CarlosAdams_ 🎥 Youtube: https://www.youtube.com/c/CarlosAdams Reseva una consultoria https://www.carlos-adams.com/ 🛍️ Tienda: Racks mafia https://www.racksmafia.com/ Instagram Racks Mafia https://www.instagram.com/racksmafia/ 🎙️ Racks Talk/Podcast: 🟢Spotify https://spoti.fi/3lJ16id 🟠IVoox https://go.ivoox.com/sq/1247728 Cambia tu vida con estos libros 🤓 https://amzn.to/3Ry7lWp Tecnología / Setup 👨‍💻 https://amzn.to/3uJ8l0o #rackstalk","dinero,inversión,pisos en madrid,burbuja inmobiliaria,vivir en madrid,educacion financiera,wallstreetwolwerine,invicthor replay,ury vice,errores financieros,carlos adams,adams replay,invicthor,wall street wolverine,impuestos,hacienda,youtubers andorra,impuestos youtube españa,impuestos youtubers,rubius,venezuela,invertir en venezuela,como es vivir en venezuela,mi experiencia en venezuela,isla margarita,vivir en isla margarita,me mudo a venezuela",22,"People & Blogs","Politics,Society",PT10M49S,649,2d,hd,false,,es-ES,https://i.ytimg.com/vi/LHW9EVJwpY8/maxresdefault.jpg,1,,,,3821,226,,0,23
27,UCKtX-l6WHwkwRS2Wh_Vg9Bw,"Divergente Digital",LUPMK-n4qAc,2025-02-19T16:30:12Z,"2025-02-19 16:30:12","INGENIERO DE JOVENLANDIA INTENTA ROBAR UN PATINETE EN PALMA DE MALLORCA 🚨","SIGUE NUESTRAS REDES - INSTAGRAM: instagram.com/divergenciadigital - CANAL DE TELEGRAM: https://t.me/divergenciadigital0 - FACEBOOK: https://www.facebook.com/profile.php?id=61564032608814&locale=es_ES - TIK TOK: https://www.tiktok.com/@divergentedigitaloficial",,25,"News & Politics",Society,PT31S,31,2d,hd,false,,es,https://i.ytimg.com/vi/LUPMK-n4qAc/maxresdefault.jpg,1,,,,20570,1843,,0,184
28,UCL9vKJFCUfArcnASZDWYK7A,Cuackdisco,86SDyfCCCp8,2024-04-07T20:20:07Z,"2024-04-07 20:20:07","JovenLandia - CuackDisco","Canción sobre JovenLandia Creada con Suno AI #suno #sunoai #jovenlandia #psoe",,22,"People & Blogs","Electronic_music,Music,Pop_music",PT1M31S,91,2d,hd,false,,,,,,,,213,5,,0,1
29,UCKtX-l6WHwkwRS2Wh_Vg9Bw,"Divergente Digital",D48tYfpoK00,2025-02-21T18:10:00Z,"2025-02-21 18:10:00","🚨 INGENIERO DE JOVENLANDIA DE 18 AÑOS ROBA 100.000€ EN BARCELONA A PUNTA DE CUCHILLO 🚨",,,25,"News & Politics",Society,PT35S,35,2d,hd,false,,es,https://i.ytimg.com/vi/D48tYfpoK00/maxresdefault.jpg,1,,,,9734,1370,,0,121
30,UCKtX-l6WHwkwRS2Wh_Vg9Bw,"Divergente Digital",rD5hKGOUUCA,2025-04-10T13:01:31Z,"2025-04-10 13:01:31","🚨 DOCTORES E INGENIEROS DE JOVENLANDIA EN VIC, BARCELONA 🚨","SIGUE NUESTRAS REDES - INSTAGRAM: instagram.com/divergenciadigital - CANAL DE TELEGRAM: https://t.me/divergenciadigital0 - FACEBOOK: https://www.facebook.com/profile.php?id=61564032608814&locale=es_ES - TIK TOK: https://www.tiktok.com/@divergentedigitaloficial",,25,"News & Politics","Politics,Society",PT1M9S,69,2d,hd,false,,es,https://i.ytimg.com/vi/rD5hKGOUUCA/maxresdefault.jpg,1,,,,2184,277,,0,27
31,UCKtX-l6WHwkwRS2Wh_Vg9Bw,"Divergente Digital",W9JixAwyq-s,2025-04-07T15:00:40Z,"2025-04-07 15:00:40","🚨 DOCTORES DE JOVENLANDIA EN BILBAO 🚨","SIGUE NUESTRAS REDES - INSTAGRAM: instagram.com/divergenciadigital - CANAL DE TELEGRAM: https://t.me/divergenciadigital0 - FACEBOOK: https://www.facebook.com/profile.php?id=61564032608814&locale=es_ES - TIK TOK: https://www.tiktok.com/@divergentedigitaloficial",,25,"News & Politics","Health,Society",PT1M20S,80,2d,hd,false,,es,https://i.ytimg.com/vi/W9JixAwyq-s/maxresdefault.jpg,1,,,,2371,287,,0,42
32,UC3NAriGIDh1iT5VeQDV6WNQ,McFLY,cYBrUxwUTqU,2025-02-25T16:00:42Z,"2025-02-25 16:00:42","JOVENLANDES INTIMIDANDO A PERSONAS EN EL METRO DE BARCELONA",,,22,"People & Blogs","Politics,Society",PT11M28S,688,2d,hd,false,,,https://i.ytimg.com/vi/cYBrUxwUTqU/maxresdefault.jpg,1,,,,77649,2628,,0,1238
33,UCoW9clnpAqInnV0vXBJqIDg,"Cristian Bodon",rXo5HL2aEyI,2024-07-12T00:27:44Z,"2024-07-12 00:27:44","Cómo defenderte en la calle. #boxeo #defensapersonal #artesmarciales #españa #politica #jovenlandia",,,24,Entertainment,"Boxing,Lifestyle_(sociology)",PT32S,32,2d,hd,false,,,https://i.ytimg.com/vi/rXo5HL2aEyI/maxresdefault.jpg,,Bilbao,43.2630126,-2.9349852,13008,669,,0,24
34,UCKtX-l6WHwkwRS2Wh_Vg9Bw,"Divergente Digital",OesxXpHxfEU,2025-01-30T17:00:24Z,"2025-01-30 17:00:24","INGENIERO DE JOVENLANDIA EN SAN SEBASTIÁN SE HACE LA VÍCTIMA CUANDO LO PILLAN 😁",,,25,"News & Politics",,PT1M37S,97,2d,hd,false,,es,https://i.ytimg.com/vi/OesxXpHxfEU/maxresdefault.jpg,1,,,,12241,1064,,0,147
35,UCLXDAzvXyPq47lvy-4GR9GA,"EL MUNDO DE SASEL",iSDj1vDg1L8,2024-10-29T18:46:09Z,"2024-10-29 18:46:09","LAS CHAROS QUIEREN JOVENLANDESES | Karens Fantasean Con Un Jovenlandes | sasel | amor","Mi canal de videojuegos saselandia: https://www.youtube.com/c/saselandia Mi twitter: https://twitter.com/Saselandia Mi canal de twitch donde hago directos: https://www.twitch.tv/saselandiadirectos Mi instagram: https://www.instagram.com/saselsega/",,22,"People & Blogs",Society,PT18M38S,1118,2d,hd,false,,,https://i.ytimg.com/vi/iSDj1vDg1L8/maxresdefault.jpg,1,,,,7583,902,,0,165
36,UCuouBvg_qgjHsSa6XmF2D1g,"Éxito con Educación Financiera",x2ioVsOw55E,2025-02-21T14:58:35Z,"2025-02-21 14:58:35","🎵 CANCIÓN viral de BILLETE DE VUELTA a JOVENLANDIA","#abascal #santiagoabascal #vox #derecha #España #liberarlismo #bajadadeimpuestos #derechaespañola #economía 🎵 CANCIÓN viral de BILLETE DE VUELTA a JOVENLANDIA fuera todos los delincuentes jovenlandeses que no comen jamón","abascal,santiagoabascal,vox,derecha,España,liberarlismo,bajadadeimpuestos,derechaespañola,economía",25,"News & Politics","Politics,Society",PT1M53S,113,2d,hd,false,,es,https://i.ytimg.com/vi/x2ioVsOw55E/maxresdefault.jpg,,,,,130,6,,0,0
37,UCKtX-l6WHwkwRS2Wh_Vg9Bw,"Divergente Digital",_fDgvnbj28c,2025-01-11T23:30:07Z,"2025-01-11 23:30:07","SPIDERMAN DE JOVENLANDIA EN ITALIA 😁","SIGUE NUESTRAS REDES - INSTAGRAM: instagram.com/divergenciadigital - CANAL DE TELEGRAM: https://t.me/divergenciadigital0 - FACEBOOK: https://www.facebook.com/profile.php?id=61564032608814&locale=es_ES - TIK TOK: https://www.tiktok.com/@divergentedigitaloficial",,25,"News & Politics",Entertainment,PT38S,38,2d,hd,false,,es,https://i.ytimg.com/vi/_fDgvnbj28c/maxresdefault.jpg,1,,,,18834,2231,,0,271
38,UCKtX-l6WHwkwRS2Wh_Vg9Bw,"Divergente Digital",u7y74On6bx8,2024-11-10T19:45:00Z,"2024-11-10 19:45:00","DOCTOR O INGENIERO DE JOVENLANDIA 😁","SIGUE NUESTRAS REDES - INSTAGRAM: instagram.com/divergenciadigital - CANAL DE TELEGRAM: https://t.me/divergenciadigital0 - FACEBOOK: https://www.facebook.com/profile.php?id=61564032608814&locale=es_ES - TIK TOK: https://www.tiktok.com/@divergentedigitaloficial",,25,"News & Politics",Entertainment,PT30S,30,2d,hd,false,,es,https://i.ytimg.com/vi/u7y74On6bx8/maxresdefault.jpg,1,,,,11125,1353,,0,248
39,UCKtX-l6WHwkwRS2Wh_Vg9Bw,"Divergente Digital",b3iY5yyh9g0,2025-04-13T18:30:44Z,"2025-04-13 18:30:44","🚨 EXHIBICIÓN DE INGENIEROS DE JOVENLANDIA EN HOSPITALET DE LLOBREGAT 🚨",,,25,"News & Politics","Politics,Society",PT2M3S,123,2d,hd,false,,es,https://i.ytimg.com/vi/b3iY5yyh9g0/maxresdefault.jpg,1,,,,2032,205,,0,13
40,UCnBBeb-9MMtNU1NAchNzTsA,AltRightEspaña,YHbB8ef0u8A,2024-03-21T05:27:02Z,"2024-03-21 05:27:02","Que es un jovenlandes #soloquedavox #vox #noticiasvox",,,22,"People & Blogs","Politics,Society",PT1M1S,61,2d,hd,false,,,https://i.ytimg.com/vi/YHbB8ef0u8A/maxresdefault.jpg,,España,40.463667,-3.74922,12020,238,,0,8
41,UCKtX-l6WHwkwRS2Wh_Vg9Bw,"Divergente Digital",N-vQOUjXkvo,2025-02-24T17:00:23Z,"2025-02-24 17:00:23","NUEVAS COSTUMBRES DE JOVENLANDIA EN BENIMACLET, VALENCIA 🚨",,,25,"News & Politics",,PT45S,45,2d,hd,false,,es,https://i.ytimg.com/vi/N-vQOUjXkvo/maxresdefault.jpg,1,,,,8701,1453,,0,171
42,UCPfjB6YCo1Oth0eh1UxQFaQ,"España Se Empodera",M1ySdVQJfcc,2024-08-10T19:23:29Z,"2024-08-10 19:23:29","🚨JOVENLANDES con 🔪 vs POLICÍA de MANCHESTER🚨","Enlace descarga del vídeo: https://drive.google.com/file/d/1BRJ6g9RrqwbnaMbuF8Ri7UlfYrIERWyY/view?usp=drivesdk Enlace Canal de Telegram: https://t.me/+pyVWmuVgJQRmYjdk","Progresismo,Agenda 2030,Globalismo,Musulmán,Islam,Marruecos,Inmigración,Inmigrante,Religión,Sucesos,Noticias,Actualidad,Información,Periodismo,Novedades,Reino Unido,Manchester,Policial,Delincuencia,Atentado,Seguridad,Política,Políticos,Socialismo",25,"News & Politics","Politics,Society",PT56S,56,2d,hd,false,,,https://i.ytimg.com/vi/M1ySdVQJfcc/maxresdefault.jpg,1,,,,12048,1718,,0,50
43,UCKtX-l6WHwkwRS2Wh_Vg9Bw,"Divergente Digital",viNq0kfwSxk,2025-05-16T13:01:51Z,"2025-05-16 13:01:51","DOCTORES DE JOVENLANDIA CON 🔪 SE BUSCAN EN BADALONA 🚨",,,25,"News & Politics",Society,PT2M29S,149,2d,hd,false,,es,https://i.ytimg.com/vi/viNq0kfwSxk/maxresdefault.jpg,1,,,,4027,714,,0,76
44,UCKtX-l6WHwkwRS2Wh_Vg9Bw,"Divergente Digital",iNbesJrGFE8,2024-11-24T17:45:00Z,"2024-11-24 17:45:00","🚨 PELEA MULTITUDINARIA EN ARUCAS CON UN JOVEN DE JOVENLANDIA TRASLADADO AL HOSPITAL 🚨","SIGUE NUESTRAS REDES - INSTAGRAM: instagram.com/divergenciadigital - CANAL DE TELEGRAM: https://t.me/divergenciadigital0 - FACEBOOK: https://www.facebook.com/profile.php?id=61564032608814&locale=es_ES - TIK TOK: https://www.tiktok.com/@divergentedigitaloficial",,25,"News & Politics","Politics,Society",PT1M16S,76,2d,hd,false,,es,https://i.ytimg.com/vi/iNbesJrGFE8/maxresdefault.jpg,1,,,,1841,220,,0,11
45,UCUvcm4EhEyDqjI8CERo5_eA,"BCN A PIE DE CALLE",7cMka0tEx4I,2024-09-18T11:00:10Z,"2024-09-18 11:00:10","CARTERISTA VIOLENTO SE LLEVA GAS PIMIENTA EN LA CARA",,,24,Entertainment,"Politics,Society",PT21S,21,2d,hd,false,,es-ES,https://i.ytimg.com/vi/7cMka0tEx4I/maxresdefault.jpg,1,,,,2091510,71607,,0,2688
46,UCKtX-l6WHwkwRS2Wh_Vg9Bw,"Divergente Digital",OvtHW996Oyw,2025-05-06T17:30:11Z,"2025-05-06 17:30:11","INGENIEROS DE JOVENLANDIA EN ACCIÓN EN FUERTEVENTURA 🚨","SIGUE NUESTRAS REDES - INSTAGRAM: instagram.com/divergenciadigital - CANAL DE TELEGRAM: https://t.me/divergenciadigital0 - FACEBOOK: https://www.facebook.com/profile.php?id=61564032608814&locale=es_ES - TIK TOK: https://www.tiktok.com/@divergentedigitaloficial",,25,"News & Politics",Society,PT1M19S,79,2d,hd,false,,es,https://i.ytimg.com/vi/OvtHW996Oyw/maxresdefault.jpg,1,,,,5145,803,,0,67
